,Topic_Num,Topic_Perc_Contrib,Keywords,Text,Slightly Cleaned,Comment Text
0,0.0,0.9590893387794495,"suck, nigger, article, cuntnlu, xdicksx, ballznigger, widr, seem, good, redirect",widr suck xdicksx widr suck xdicksx widr suck xdicksx widr suck xdicksx widr suck xdicksx widr suck xdicksx widr suck xdicksx,Widr suck xDICKSx Widr suck xDICKSx Widr suck xDICKSx Widr suck xDICKSx Widr suck xDICKSx Widr suck xDICKSx Widr suck xDICKSx,"Widr sucks xDICKSx 
 Widr sucks xDICKSx 
 Widr sucks xDICKSx 
 Widr sucks xDICKSx 
 Widr sucks xDICKSx 
 Widr sucks xDICKSx 
 Widr sucks xDICKSx"
1,1.0,0.943749725818634,"cunt, smelly, moist, comment, list, thank, notability, book, decline, byline",cunt cunt cunt cunt cunt cunt cunt cunt cunt cunt cunt cunt moist smelly cunt,cunt cunt cunt cunt cunt cunt cunt cunt cunt cunt cunt cunt moist smelly cunt,cunt cunt cunt cunt cunt cunt cunt cunt cunt cunt cunt cunt moist smelly cunt
2,2.0,0.9895314574241638,"article, section, first, topic, viewpoint, silly, comment, agree, subject, claim",suspect responsible phonetics section add linguistics section claim literary text quote natural language believe find citation support ought therefore delete much defence keep transcript subjective pov retain make second tell story necessary add evidence inadmissable duality subject certainly agree fable connection ipa work interesting mention include never argue otherwise transcription technical data however intrusive belongs seperate article focus subject therefore propose create article time proper citation provide link article remain focused fable general can not agree essence discussion subedit happy matter take arbitration would interest learn opinion others mzilikazi talk,"I suspect you be responsible for the Phonetics section . Was it you too who add the linguistics section with its claim that the literary text you quote be 'natural ' language ? I do not believe you can find a citation to support this and it ought therefore to be delete . Much of your defence for keep the transcript be subjective POV . Retaining them make the second telling of the story necessary , which be added evidence for an inadmissable duality of subject . I certainly agree that the fable connection with the IPA work be interesting and mention of that should be include ; I never argue otherwise . Transcription of technical data , however , be intrusive and belongs in a seperate article with a focus on that subject . I be therefore propose that you create such an article , this time with proper citation , and provide a link to this article , which should remain focused on the fable in general . If we can not agree on what be in essence a discussion of sub-editing , I 'd be happy for the matter to be take to arbitration . It would be interest to learn the opinion of others . Mzilikazi1939 ( talk )","I suspected you were responsible for the Phonetics section. Was it you too who added the linguistics sections with its claim that the literary text you quote is 'natural' language? I don't believe you can find a citation to support this and it ought therefore to be deleted. 

 Much of your defence for keeping the transcripts is subjective POV. Retaining them makes the second telling of the story necessary, which is added evidence for an inadmissable duality of subject. I certainly agree that the fable's connection with the IPA's work is interesting and mention of that should be included; I never argued otherwise. Transcription of technical data, however, is intrusive and belongs in a seperate article with a focus on that subject. I am therefore proposing that you create such an article, this time with proper citations, and provide a link to this article, which should remain focused on the fable in general. 

 If we can't agree on what is in essence a discussion of sub-editing, I'd be happy for the matter to be taken to arbitration. It would be interesting to learn the opinion of others. Mzilikazi1939 (talk)"
3,3.0,0.9549971222877502,"cock, hammersoft, suck, category, cuntnlu, userpage, article, change, texas, give",category change hi clean category texas notice userpage list category article change userpage point category wikipedians texas userpage category instead,"==Category change== Hi . I be clean up the category Texas and notice that your userpage be list there . That category be for article only , so I change your userpage to point to category Wikipedians in Texas ( a userpage category ) instead .","==Category change== 
 Hi.  I was cleaning up the category Texas and noticed that your userpage was listed there.  That category is for articles only, so I changed your userpage to point to category Wikipedians in Texas (a userpage category) instead."
4,4.0,0.9774972200393677,"article, theory, add, decline, link, machine, assembly, fall, use, word",yes thats one theory another theory gibbon say decline fall implicit cant seperate thing least level want write article transformist decline view late antiquity good start article simply collection theory regard decline fall practical linking reason since many people use terminology article gateway article,"Yes thats one theory . Another theory by Gibbon say the Decline and Fall be implicit . You cant seperate these thing , at least at this level . If you want to write an article just about the transformist ( decline ) view , then Late Antiquity be a good start . But this article simply be a collection of all theory regard decline and fall , for practical linking reason , since so many people use the terminology in article , this be a gateway article .","Yes thats one theory. Another theory by Gibbon says the Decline and Fall are implicit. You cant seperate these things, at least at this level. If you want to write an article just about the transformist (decline) view, then Late Antiquity is a good start. But this article simply is a collection of all theories regarding decline and fall, for practical linking reasons, since so many people use the terminology in articles, this is a gateway article."
5,5.0,0.9833325743675232,"article, name, ventura, read, link, engine, write, barry, also, thank",hello laurel thank advice de barra family name also come ireland like self research family ancestry last thirty year extensive knowalage history orgins name past generation generation also hold master degree liberal art history fact write thesis anglo saxon change make correct spelling name name de barry incorrect de barra french name de means de barry dose exist barry anglicization de barra kind regard wendy,"Hello Laurel , Thank you for your advice ... de barra be my family name , i also come from ireland like your self , and have be research our family ancestry for the last thirty year , i have extensive knowalage on the history and orgins of our name which have be past down from generation to generation . I also hold a master degree in liberal art and history in fact i write my thesis on the ' anglo saxon ' The change i make be to correct the spelling of the name only , The name de Barry be incorrect ....... it be ' de Barra ' ..... it be a french name and the ' de ' mean 'of ' , de barry dose not exist . Barry be the anglicization of 'de barra ' Kind regard Wendy","Hello Laurel , 

 Thank you for your advice ...de barra is my family name ,i also come from ireland like your self, and have been researching our family ancestry for the last thirty years , 
 i have extensive knowalage on the history and orgins of our name which has been past down from generation to generation. 

 I also hold a masters degree in liberal arts and history in fact i wrote my thesis on the' anglo saxons' 
 The changes i made were  to correct the spelling of the name only , 

 The name de Barry is incorrect .......it is' de Barra '.....  it is a french name and  the ' de'  means 'of ' , de barry dose not exist. 
 Barry is the anglicization of 'de barra' 
 Kind regards  
 Wendy"
6,6.0,0.9980132579803467,"vandalizer, cuntnlu, nlu, article, cunt, belarusian, jem, assembly, link, nazist",vandalizer vandalizer vandalizer vandalizer vandalizer vandalizer vandalizer vandalizer vandalizer vandalizer vandalizer vandalizer vandalizer vandalizer vandalizer vandalizer vandalizer vandalizer vandalizer vandalizer vandalizer vandalizer vandalizer vandalizer vandalizer vandalizer vandalizer vandalizer vandalizer vandalizer vandalizer vandalizer vandalizer vandalizer vandalizer vandalizer vandalizer vandalizer vandalizer vandalizer vandalizer vandalizer vandalizer vandalizer vandalizer vandalizer vandalizer vandalizer vandalizer vandalizer vandalizer vandalizer vandalizer vandalizer vandalizer vandalizer vandalizer vandalizer vandalizer vandalizer vandalizer vandalizer vandalizer vandalizer vandalizer vandalizer vandalizer vandalizer vandalizer vandalizer vandalizer vandalizer vandalizer vandalizer vandalizer vandalizer vandalizer vandalizer vandalizer vandalizer vandalizer vandalizer vandalizer vandalizer vandalizer vandalizer vandalizer vandalizer vandalizer vandalizer vandalizer vandalizer vandalizer vandalizer vandalizer vandalizer vandalizer vandalizer vandalizer vandalizer vandalizer vandalizer vandalizer vandalizer vandalizer vandalizer vandalizer vandalizer vandalizer vandalizer vandalizer vandalizer vandalizer vandalizer vandalizer vandalizer vandalizer vandalizer vandalizer vandalizer vandalizer vandalizer vandalizer vandalizer vandalizer vandalizer vandalizer vandalizer vandalizer vandalizer vandalizer vandalizer vandalizer vandalizer vandalizer vandalizer vandalizer vandalizer vandalizer vandalizer vandalizer vandalizer vandalizer vandalizer vandalizer vandalizer vandalizer vandalizer vandalizer vandalizer vandalizer vandalizer vandalizer vandalizer vandalizer vandalizer vandalizer vandalizer vandalizer vandalizer vandalizer vandalizer vandalizer vandalizer vandalizer vandalizer vandalizer vandalizer vandalizer vandalizer vandalizer vandalizer vandalizer vandalizer vandalizer vandalizer vandalizer vandalizer vandalizer vandalizer vandalizer vandalizer vandalizer vandalizer vandalizer vandalizer vandalizer vandalizer vandalizer vandalizer vandalizer vandalizer vandalizer vandalizer vandalizer vandalizer vandalizer vandalizer vandalizer vandalizer vandalizer vandalizer vandalizer vandalizer vandalizer vandalizer vandalizer vandalizer vandalizer vandalizer vandalizer vandalizer vandalizer vandalizer vandalizer vandalizer vandalizer vandalizer vandalizer vandalizer vandalizer vandalizer vandalizer vandalizer vandalizer vandalizer vandalizer vandalizer vandalizer vandalizer vandalizer vandalizer vandalizer vandalizer vandalizer vandalizer vandalizer vandalizer vandalizer vandalizer vandalizer vandalizer vandalizer vandalizer vandalizer vandalizer vandalizer vandalizer vandalizer vandalizer vandalizer vandalizer vandalizer vandalizer vandalizer vandalizer vandalizer vandalizer vandalizer vandalizer vandalizer vandalizer vandalizer vandalizer vandalizer vandalizer vandalizer vandalizer vandalizer vandalizer vandalizer vandalizer vandalizer vandalizer vandalizer vandalizer vandalizer vandalizer vandalizer vandalizer vandalizer vandalizer vandalizer vandalizer vandalizer vandalizer vandalizer vandalizer vandalizer vandalizer vandalizer vandalizer vandalizer vandalizer vandalizer vandalizer vandalizer vandalizer vandalizer vandalizer vandalizer vandalizer vandalizer vandalizer vandalizer vandalizer vandalizer vandalizer vandalizer vandalizer vandalizer vandalizer vandalizer vandalizer vandalizer vandalizer vandalizer vandalizer vandalizer vandalizer vandalizer vandalizer vandalizer vandalizer vandalizer vandalizer vandalizer vandalizer vandalizer vandalizer vandalizer vandalizer vandalizer vandalizer vandalizer vandalizer vandalizer vandalizer vandalizer vandalizer vandalizer vandalizer vandalizer vandalizer vandalizer vandalizer vandalizer vandalizer vandalizer vandalizer vandalizer vandalizer vandalizer vandalizer vandalizer vandalizer vandalizer vandalizer vandalizer vandalizer vandalizer vandalizer vandalizer vandalizer vandalizer vandalizer vandalizer vandalizer vandalizer vandalizer vandalizer vandalizer vandalizer vandalizer vandalizer vandalizer vandalizer vandalizer vandalizer vandalizer vandalizer vandalizer vandalizer vandalizer vandalizer vandalizer vandalizer vandalizer vandalizer vandalizer vandalizer vandalizer vandalizer vandalizer vandalizer vandalizer vandalizer vandalizer vandalizer vandalizer vandalizer vandalizer vandalizer vandalizer vandalizer vandalizer vandalizer vandalizer vandalizer vandalizer vandalizer vandalizer vandalizer vandalizer vandalizer vandalizer vandalizer vandalizer vandalizer vandalizer vandalizer vandalizer vandalizer vandalizer vandalizer vandalizer vandalizer vandalizer vandalizer vandalizer vandalizer vandalizer vandalizer vandalizer vandalizer vandalizer vandalizer vandalizer vandalizer vandalizer vandalizer vandalizer vandalizer vandalizer vandalizer vandalizer vandalizer vandalizer vandalizer vandalizer vandalizer vandalize,== You Vandalizer == Vandalizer Vandalizer Vandalizer Vandalizer Vandalizer Vandalizer Vandalizer Vandalizer Vandalizer Vandalizer Vandalizer Vandalizer Vandalizer Vandalizer Vandalizer Vandalizer Vandalizer Vandalizer Vandalizer Vandalizer Vandalizer Vandalizer Vandalizer Vandalizer Vandalizer Vandalizer Vandalizer Vandalizer Vandalizer Vandalizer Vandalizer Vandalizer Vandalizer Vandalizer Vandalizer Vandalizer Vandalizer Vandalizer Vandalizer Vandalizer Vandalizer Vandalizer Vandalizer Vandalizer Vandalizer Vandalizer Vandalizer Vandalizer Vandalizer Vandalizer Vandalizer Vandalizer Vandalizer Vandalizer Vandalizer Vandalizer Vandalizer Vandalizer Vandalizer Vandalizer Vandalizer Vandalizer Vandalizer Vandalizer Vandalizer Vandalizer Vandalizer Vandalizer Vandalizer Vandalizer Vandalizer Vandalizer Vandalizer Vandalizer Vandalizer Vandalizer Vandalizer Vandalizer Vandalizer Vandalizer Vandalizer Vandalizer Vandalizer Vandalizer Vandalizer Vandalizer Vandalizer Vandalizer Vandalizer Vandalizer Vandalizer Vandalizer Vandalizer Vandalizer Vandalizer Vandalizer Vandalizer Vandalizer Vandalizer Vandalizer Vandalizer Vandalizer Vandalizer Vandalizer Vandalizer Vandalizer Vandalizer Vandalizer Vandalizer Vandalizer Vandalizer Vandalizer Vandalizer Vandalizer Vandalizer Vandalizer Vandalizer Vandalizer Vandalizer Vandalizer Vandalizer Vandalizer Vandalizer Vandalizer Vandalizer Vandalizer Vandalizer Vandalizer Vandalizer Vandalizer Vandalizer Vandalizer Vandalizer Vandalizer Vandalizer Vandalizer Vandalizer Vandalizer Vandalizer Vandalizer Vandalizer Vandalizer Vandalizer Vandalizer Vandalizer Vandalizer Vandalizer Vandalizer Vandalizer Vandalizer Vandalizer Vandalizer Vandalizer Vandalizer Vandalizer Vandalizer Vandalizer Vandalizer Vandalizer Vandalizer Vandalizer Vandalizer Vandalizer Vandalizer Vandalizer Vandalizer Vandalizer Vandalizer Vandalizer Vandalizer Vandalizer Vandalizer Vandalizer Vandalizer Vandalizer Vandalizer Vandalizer Vandalizer Vandalizer Vandalizer Vandalizer Vandalizer Vandalizer Vandalizer Vandalizer Vandalizer Vandalizer Vandalizer Vandalizer Vandalizer Vandalizer Vandalizer Vandalizer Vandalizer Vandalizer Vandalizer Vandalizer Vandalizer Vandalizer Vandalizer Vandalizer Vandalizer Vandalizer Vandalizer Vandalizer Vandalizer Vandalizer Vandalizer Vandalizer Vandalizer Vandalizer Vandalizer Vandalizer Vandalizer Vandalizer Vandalizer Vandalizer Vandalizer Vandalizer Vandalizer Vandalizer Vandalizer Vandalizer Vandalizer Vandalizer Vandalizer Vandalizer Vandalizer Vandalizer Vandalizer Vandalizer Vandalizer Vandalizer Vandalizer Vandalizer Vandalizer Vandalizer Vandalizer Vandalizer Vandalizer Vandalizer Vandalizer Vandalizer Vandalizer Vandalizer Vandalizer Vandalizer Vandalizer Vandalizer Vandalizer Vandalizer Vandalizer Vandalizer Vandalizer Vandalizer Vandalizer Vandalizer Vandalizer Vandalizer Vandalizer Vandalizer Vandalizer Vandalizer Vandalizer Vandalizer Vandalizer Vandalizer Vandalizer Vandalizer Vandalizer Vandalizer Vandalizer Vandalizer Vandalizer Vandalizer Vandalizer Vandalizer Vandalizer Vandalizer Vandalizer Vandalizer Vandalizer Vandalizer Vandalizer Vandalizer Vandalizer Vandalizer Vandalizer Vandalizer Vandalizer Vandalizer Vandalizer Vandalizer Vandalizer Vandalizer Vandalizer Vandalizer Vandalizer Vandalizer Vandalizer Vandalizer Vandalizer Vandalizer Vandalizer Vandalizer Vandalizer Vandalizer Vandalizer Vandalizer Vandalizer Vandalizer Vandalizer Vandalizer Vandalizer Vandalizer Vandalizer Vandalizer Vandalizer Vandalizer Vandalizer Vandalizer Vandalizer Vandalizer Vandalizer Vandalizer Vandalizer Vandalizer Vandalizer Vandalizer Vandalizer Vandalizer Vandalizer Vandalizer Vandalizer Vandalizer Vandalizer Vandalizer Vandalizer Vandalizer Vandalizer Vandalizer Vandalizer Vandalizer Vandalizer Vandalizer Vandalizer Vandalizer Vandalizer Vandalizer Vandalizer Vandalizer Vandalizer Vandalizer Vandalizer Vandalizer Vandalizer Vandalizer Vandalizer Vandalizer Vandalizer Vandalizer Vandalizer Vandalizer Vandalizer Vandalizer Vandalizer Vandalizer Vandalizer Vandalizer Vandalizer Vandalizer Vandalizer Vandalizer Vandalizer Vandalizer Vandalizer Vandalizer Vandalizer Vandalizer Vandalizer Vandalizer Vandalizer Vandalizer Vandalizer Vandalizer Vandalizer Vandalizer Vandalizer Vandalizer Vandalizer Vandalizer Vandalizer Vandalizer Vandalizer Vandalizer Vandalizer Vandalizer Vandalizer Vandalizer Vandalizer Vandalizer Vandalizer Vandalizer Vandalizer Vandalizer Vandalizer Vandalizer Vandalizer Vandalizer Vandalizer Vandalizer Vandalizer Vandalizer Vandalizer Vandalizer Vandalizer Vandalizer Vandalizer Vandalizer Vandalizer Vandalizer Vandalizer Vandalizer Vandalizer Vandalizer Vandalizer Vandalizer Vandalizer Vandalizer Vandalizer Vandalizer Vandalizer Vandalizer Vandalizer Vandalizer Vandalizer Vandalizer Vandalizer Vandalizer Vandalizer Vandalizer Vandalizer Vandalizer Vandalizer Vandalizer Vandalizer Vandalizer Vandalizer Vandalizer Vandalizer Vandalize,"== You Vandalizer == 
 Vandalizer Vandalizer Vandalizer Vandalizer Vandalizer Vandalizer Vandalizer Vandalizer Vandalizer Vandalizer Vandalizer Vandalizer Vandalizer Vandalizer Vandalizer Vandalizer Vandalizer Vandalizer Vandalizer Vandalizer Vandalizer Vandalizer Vandalizer Vandalizer Vandalizer Vandalizer Vandalizer Vandalizer Vandalizer Vandalizer Vandalizer Vandalizer Vandalizer Vandalizer Vandalizer Vandalizer Vandalizer Vandalizer Vandalizer Vandalizer Vandalizer Vandalizer Vandalizer Vandalizer Vandalizer Vandalizer Vandalizer Vandalizer Vandalizer Vandalizer Vandalizer Vandalizer Vandalizer Vandalizer Vandalizer Vandalizer Vandalizer Vandalizer Vandalizer Vandalizer Vandalizer Vandalizer Vandalizer Vandalizer Vandalizer Vandalizer Vandalizer Vandalizer Vandalizer Vandalizer Vandalizer Vandalizer Vandalizer Vandalizer Vandalizer Vandalizer Vandalizer Vandalizer Vandalizer Vandalizer Vandalizer Vandalizer Vandalizer Vandalizer Vandalizer Vandalizer Vandalizer Vandalizer Vandalizer Vandalizer Vandalizer Vandalizer Vandalizer Vandalizer Vandalizer Vandalizer Vandalizer Vandalizer Vandalizer Vandalizer Vandalizer Vandalizer Vandalizer Vandalizer Vandalizer Vandalizer Vandalizer Vandalizer Vandalizer Vandalizer Vandalizer Vandalizer Vandalizer Vandalizer Vandalizer Vandalizer Vandalizer Vandalizer Vandalizer Vandalizer Vandalizer Vandalizer Vandalizer Vandalizer Vandalizer Vandalizer Vandalizer Vandalizer Vandalizer Vandalizer Vandalizer Vandalizer Vandalizer Vandalizer Vandalizer Vandalizer Vandalizer Vandalizer Vandalizer Vandalizer Vandalizer Vandalizer Vandalizer Vandalizer Vandalizer Vandalizer Vandalizer Vandalizer Vandalizer Vandalizer Vandalizer Vandalizer Vandalizer Vandalizer Vandalizer Vandalizer Vandalizer Vandalizer Vandalizer Vandalizer Vandalizer Vandalizer Vandalizer Vandalizer Vandalizer Vandalizer Vandalizer Vandalizer Vandalizer Vandalizer Vandalizer Vandalizer Vandalizer Vandalizer Vandalizer Vandalizer Vandalizer Vandalizer Vandalizer Vandalizer Vandalizer Vandalizer Vandalizer Vandalizer Vandalizer Vandalizer Vandalizer Vandalizer Vandalizer Vandalizer Vandalizer Vandalizer Vandalizer Vandalizer Vandalizer Vandalizer Vandalizer Vandalizer Vandalizer Vandalizer Vandalizer Vandalizer Vandalizer Vandalizer Vandalizer Vandalizer Vandalizer Vandalizer Vandalizer Vandalizer Vandalizer Vandalizer Vandalizer Vandalizer Vandalizer Vandalizer Vandalizer Vandalizer Vandalizer Vandalizer Vandalizer Vandalizer Vandalizer Vandalizer Vandalizer Vandalizer Vandalizer Vandalizer Vandalizer Vandalizer Vandalizer Vandalizer Vandalizer Vandalizer Vandalizer Vandalizer Vandalizer Vandalizer Vandalizer Vandalizer Vandalizer Vandalizer Vandalizer Vandalizer Vandalizer Vandalizer Vandalizer Vandalizer Vandalizer Vandalizer Vandalizer Vandalizer Vandalizer Vandalizer Vandalizer Vandalizer Vandalizer Vandalizer Vandalizer Vandalizer Vandalizer Vandalizer Vandalizer Vandalizer Vandalizer Vandalizer Vandalizer Vandalizer Vandalizer Vandalizer Vandalizer Vandalizer Vandalizer Vandalizer Vandalizer Vandalizer Vandalizer Vandalizer Vandalizer Vandalizer Vandalizer Vandalizer Vandalizer Vandalizer Vandalizer Vandalizer Vandalizer Vandalizer Vandalizer Vandalizer Vandalizer Vandalizer Vandalizer Vandalizer Vandalizer Vandalizer Vandalizer Vandalizer Vandalizer Vandalizer Vandalizer Vandalizer Vandalizer Vandalizer Vandalizer Vandalizer Vandalizer Vandalizer Vandalizer Vandalizer Vandalizer Vandalizer Vandalizer Vandalizer Vandalizer Vandalizer Vandalizer Vandalizer Vandalizer Vandalizer Vandalizer Vandalizer Vandalizer Vandalizer Vandalizer Vandalizer Vandalizer Vandalizer Vandalizer Vandalizer Vandalizer Vandalizer Vandalizer Vandalizer Vandalizer Vandalizer Vandalizer Vandalizer Vandalizer Vandalizer Vandalizer Vandalizer Vandalizer Vandalizer Vandalizer Vandalizer Vandalizer Vandalizer Vandalizer Vandalizer Vandalizer Vandalizer Vandalizer Vandalizer Vandalizer Vandalizer Vandalizer Vandalizer Vandalizer Vandalizer Vandalizer Vandalizer Vandalizer Vandalizer Vandalizer Vandalizer Vandalizer Vandalizer Vandalizer Vandalizer Vandalizer Vandalizer Vandalizer Vandalizer Vandalizer Vandalizer Vandalizer Vandalizer Vandalizer Vandalizer Vandalizer Vandalizer Vandalizer Vandalizer Vandalizer Vandalizer Vandalizer Vandalizer Vandalizer Vandalizer Vandalizer Vandalizer Vandalizer Vandalizer Vandalizer Vandalizer Vandalizer Vandalizer Vandalizer Vandalizer Vandalizer Vandalizer Vandalizer Vandalizer Vandalizer Vandalizer Vandalizer Vandalizer Vandalizer Vandalizer Vandalizer Vandalizer Vandalizer Vandalizer Vandalizer Vandalizer Vandalizer Vandalizer Vandalizer Vandalizer Vandalizer Vandalizer Vandalizer Vandalizer Vandalizer Vandalizer Vandalizer Vandalizer Vandalizer Vandalizer Vandalizer Vandalizer Vandalizer Vandalizer Vandalizer Vandalizer Vandalizer Vandalizer Vandalizer Vandalizer Vandalizer Vandalizer Vandalizer Vandalizer Vandalizer Vandalizer Vandalizer Vandalizer Vandalizer Vandalizer Vandalize"
7,7.0,0.9699980020523071,"article, theory, write, conspiracy, consensus, ask, actively, unite, proposal, appear",go propse back get topic ban peter seller basically write article c class stage miff developed article overrode write warped vendetta article ca schrod particular spot ca chaplin review reason try trouble,". I be go to propse a while back to get him topic ban from Peter Sellers . Basically he write the article up until the c class stage and he have / he be miff that we develop the article and override what he write . He now have a warped vendetta against the article and Cass and Schrod in particular . He spot Cass do the Chaplin review , the only reason why he try to because trouble",". I was going to propse a while back to get him topic banned from Peter Sellers. Basically he wrote the article up until the c class stage and he's miffed that we developed the article and overrode what he wrote. He now has a warped vendetta against the article and Cass and Schrod in particular. He spotted Cass doing the Chaplin review, the only reason why he tried to cause trouble"
