,Topic_Num,Topic_Perc_Contrib,Keywords,Text,Slightly Cleaned,Comment Text
8,8.0,0.9906242489814758,"article, use, see, compton, give, title, diacritic, new, come, discussion",romanization serbian hey noteced edits article want tell great job thank expand make effort improve fix perfectly part miss period wwii beleave must crutial period language merge creation serbocroatoslovenian must period new language become bialphabetical thus serbs start option writting language call scs alphabet make sense right cant find source event make come conclusion anyway come series discussion use diacritic wp come late last one sure active discussion regard anymore new discussion certainly appear consensus reach user strongly oppose use diacritic article title ictu oculi favour diacritic although would mind much end eliminate mean fanatic prefer correct native title would use ok end drop would prefer consensus reach,"== Romanization of Serbian == Hey , I noteced your edits at that article , and I just want to tell you that you do a great job and to thank you for expand it . make an effort to improve it , but you fix it perfectly just after . The only part which be miss be the period between 1918-WWII . I beleave that must be the crutial period , as it be then that the language be merge with the creation of the Serbo-Croato-Slovenian , and it must be during that period that the new language become bi-alphabetical . Thus it be then that Serbs start have the option of writting its language , now call S-C-S , in both alphabet . Makes sense , right ? I can´t find any source for this , but all event make me come to this conclusion . Anyway , all of this come from a series of discussion about the use of diacritic in WP . I come late to the last one , and by now I be not sure there be any active discussion regard it anymore . But new discussion will certainly appear , as no consensus be reach , and there be some user which strongly oppose the use of diacritic in article title . In ictu oculus be in favour of diacritic , me too , although I would not mind that much if they end up eliminate . I mean , I be not fanatic over this , I just prefer them so correct native title would be use , but I be OK if they end up be drop , I would just prefer that a consensus be reach once and for all .","== Romanization of Serbian == 

 Hey, I noteced your edits at that article, and I just wanted to tell you that you did a great job and to thank you for expanding it.   made an effort to improve it, but you fixed it perfectly just after.  The only part which is missing is the period between 1918-WWII.  I beleave that must be the crutial period, as it was then that the languages were merged with the creation of the Serbo-Croato-Slovenian, and it must be during that period that the new language became bi-alphabetical.  Thus it was then that Serbs start having the option of writting its language, now called S-C-S, in both alphabets.  Makes sense, right?  I can´t find any source for this, but all events make me come to this conclusion. 

 Anyway, all of this comes from a series of discussions about the use of diacritics in WP.  I came late to the last one, and by now I am not sure there is any active discussion regarding it anymore.  But new discussions will certainly appear, as no consensus was reached, and there are some users which strongly oppose the use of diacritics in article titles.  In ictu oculi was in favour of diacritics, me too, although I would not mind that much if they end up eliminated.  I mean, I am not fanatic over this, I just prefer them so correct native titles would be used, but I am OK if they end up being dropped, I would just prefer that a consensus is reached once and for all."
9,9.0,0.9990565776824951,"suck, nigger, article, ballznigger, nat, widr, source, burmese, murder, xdicksx",grrrrrrrrrrrrrrrrrrrrrrrrrrrrrrrrrrrrrrrrrrrrrrrrrrrrrrrrrrrrrrrrrrrrrrrrrrrrrrrrrrrrrrrrrrrrrrrrrrrrrrrrrrrrrrrrrrrrrrrrrrrrrrrrrrrrrrrrrrrrrrrrrrrrrrrrrrrrrrrrrrrrrrrrrrrrrrrrrrrrrrrrrrrrrrrrrrrr suck suck suck suck suck suck suck suck suck suck suck suck suck suck suck suck suck suck suck suck suck suck suck suck suck suck suck suck suck suck suck suck suck suck suck suck suck suck suck suck suck suck suck suck suck suck suck suck suck suck suck suck suck suck suck suck suck suck suck suck suck suck suck suck suck suck suck suck suck suck suck suck suck suck suck suck suck suck suck suck suck suck suck suck suck suck suck suck suck suck suck suck suck suck suck suck suck suck suck suck suck suck suck suck suck suck suck suck suck suck suck suck suck suck suck suck suck suck suck suck suck suck suck suck suck suck suck suck suck suck suck suck suck suck suck suck suck suck suck suck suck suck suck suck suck suck suck suck suck suck suck suck suck suck suck suck suck suck suck suck suck suck suck suck suck suck suck suck suck suck suck suck suck suck suck suck suck suck suck suck suck suck suck suck suck suck suck suck suck suck suck suck suck suck suck suck suck suck suck suck suck suck suck suck suck suck suck suck suck suck suck suck suck suck suck suck suck suck suck suck suck suck suck suck suck suck suck suck suck suck suck suck suck suck suck suck suck suck suck suck suck suck suck suck suck suck suck suck suck suck suck suck suck suck suck suck suck suck suck suck suck suck suck suck suck suck suck suck suck suck suck suck suck suck suck suck suck suck suck suck suck suck suck suck suck suck suck suck suck suck suck suck suck suck suck suck suck suck suck suck suck suck suck suck suck suck suck suck suck suck suck suck suck suck suck suck suck suck suck suck suck suck suck suck suck suck suck suck suck suck suck suck suck suck suck suck suck suck suck suck suck suck suck suck suck suck suck suck suck suck suck suck suck suck suck suck suck suck suck suck suck suck suck suck suck suck suck suck suck suck suck suck suck suck suck suck suck suck suck suck suck suck suck suck suck suck suck suck suck suck suck suck suck suck suck suck suck suck suck suck suck suck suck suck suck suck suck suck suck suck suck suck suck suck suck suck suck suck suck suck suck suck suck suck suck suck suck suck suck suck suck suck suck suck suck suck suck suck suck suck suck suck suck suck suck suck suck suck suck suck suck suck suck suck suck suck suck suck suck suck suck suck suck suck suck suck suck suck suck suck suck suck suck suck suck suck suck suck suck suck suck suck suck suck suck suck suck suck suck suck suck suck suck suck suck suck suck suck suck suck suck suck suck suck suck suck suck suck suck suck suck suck suck suck suck suck suck suck suck suck suck suck suck suck suck suck suck suck suck suck suck suck suck suck suck suck suck suck suck suck suck suck suck suck suck suck suck suck suck suck suck suck suck suck suck suck suck suck suck suck suck suck suck suck suck suck suck suck suck suck suck suck suck suck suck suck suck suck suck suck suck suck suck suck suck suck suck suck suck suck suck suck suck suck suck suck suck suck suck suck suck suck suck suck suck suck suck suck suck suck suck suck suck suck suck suck suck suck suck suck suck suck suck suck suck suck suck suck suck suck suck suck suck suck suck suck suck suck suck suck suck suck suck suck suck suck suck suck suck suck suck suck suck suck suck suck suck suck suck suck suck suck suck suck suck suck suck suck suck suck suck suck suck suck suck suck suck suck suck suck suck suck suck suck suck suck suck suck suck suck suck suck suck suck suck suck suck suck suck suck suck suck suck suck suck suck suck suck suck suck suck suck suck suck suck suck suck suck suck suck suck suck suck suck suck suck suck suck suck suck suck suck suck suck suck suck suck suck suck suck suck suck suck suck suck suck suck suck suck suck suck suck suck suck suck suck suck suck suck suck suck suck suck suck suck suck suck suck suck suck suck suck suck suck suck suck suck suck suck suck suck suck suck suck suck suck suck suck suck suck suck suck suck suck suck suck suck suck suck suck suck suck suck suck suck suck suck suck suck suck suck suck suck suck suck suck suck suck suck suck suck suck suck suck suck suck suck suck suck suck suck suck suck suck suck suck suck suck suck suck suck suck suck suck suck suck suck suck suck suck suck suck suck suck suck suck suck suck suck suck suck suck suck suck suck suck suck suck suck suck suck suck suck suck suck suck suck suck suck suck suck suck suck suck suck suck suck suck suck suck suck suck suck suck suck suck suck suck suck suck suck suck suck suck suck suck suck suck suck suck suck suck suck suck suck suck suck suck suck suck suck suck suck suck suck suck suck suck suck suck suck suck suck suck suck suck suck suck suck suck suck suck suck suck suck suck suck suck suck suck suck suck suck,== Grrrrrrrrrrrrrrrrrrrrrrrrrrrrrrrrrrrrrrrrrrrrrrrrrrrrrrrrrrrrrrrrrrrrrrrrrrrrrrrrrrrrrrrrrrrrrrrrrrrrrrrrrrrrrrrrrrrrrrrrrrrrrrrrrrrrrrrrrrrrrrrrrrrrrrrrrrrrrrrrrrrrrrrrrrrrrrrrrrrrrrrrrrrrrrrrrrrr == You suck suck suck suck suck suck suck suck suck suck suck suck suck suck suck suck suck suck suck suck suck suck suck suck suck suck suck suck suck suck suck suck suck suck suck suck suck suck suck suck suck suck suck suck suck suck suck suck suck suck suck suck suck suck suck suck suck suck suck suck suck suck suck suck suck suck suck suck suck suck suck suck suck suck suck suck suck suck suck suck suck suck suck suck suck suck suck suck suck suck suck suck suck suck suck suck suck suck suck suck suck suck suck suck suck suck suck suck suck suck suck suck suck suck suck suck suck suck suck suck suck suck suck suck suck suck suck suck suck suck suck suck suck suck suck suck suck suck suck suck suck suck suck suck suck suck suck suck suck suck suck suck suck suck suck suck suck suck suck suck suck suck suck suck suck suck suck suck suck suck suck suck suck suck suck suck suck suck suck suck suck suck suck suck suck suck suck suck suck suck suck suck suck suck suck suck suck suck suck suck suck suck suck suck suck suck suck suck suck suck suck suck suck suck suck suck suck suck suck suck suck suck suck suck suck suck suck suck suck suck suck suck suck suck suck suck suck suck suck suck suck suck suck suck suck suck suck suck suck suck suck suck suck suck suck suck suck suck suck suck suck suck suck suck suck suck suck suck suck suck suck suck suck suck suck suck suck suck suck suck suck suck suck suck suck suck suck suck suck suck suck suck suck suck suck suck suck suck suck suck suck suck suck suck suck suck suck suck suck suck suck suck suck suck suck suck suck suck suck suck suck suck suck suck suck suck suck suck suck suck suck suck suck suck suck suck suck suck suck suck suck suck suck suck suck suck suck suck suck suck suck suck suck suck suck suck suck suck suck suck suck suck suck suck suck suck suck suck suck suck suck suck suck suck suck suck suck suck suck suck suck suck suck suck suck suck suck suck suck suck suck suck suck suck suck suck suck suck suck suck suck suck suck suck suck suck suck suck suck suck suck suck suck suck suck suck suck suck suck suck suck suck suck suck suck suck suck suck suck suck suck suck suck suck suck suck suck suck suck suck suck suck suck suck suck suck suck suck suck suck suck suck suck suck suck suck suck suck suck suck suck suck suck suck suck suck suck suck suck suck suck suck suck suck suck suck suck suck suck suck suck suck suck suck suck suck suck suck suck suck suck suck suck suck suck suck suck suck suck suck suck suck suck suck suck suck suck suck suck suck suck suck suck suck suck suck suck suck suck suck suck suck suck suck suck suck suck suck suck suck suck suck suck suck suck suck suck suck suck suck suck suck suck suck suck suck suck suck suck suck suck suck suck suck suck suck suck suck suck suck suck suck suck suck suck suck suck suck suck suck suck suck suck suck suck suck suck suck suck suck suck suck suck suck suck suck suck suck suck suck suck suck suck suck suck suck suck suck suck suck suck suck suck suck suck suck suck suck suck suck suck suck suck suck suck suck suck suck suck suck suck suck suck suck suck suck suck suck suck suck suck suck suck suck suck suck suck suck suck suck suck suck suck suck suck suck suck suck suck suck suck suck suck suck suck suck suck suck suck suck suck suck suck suck suck suck suck suck suck suck suck suck suck suck suck suck suck suck suck suck suck suck suck suck suck suck suck suck suck suck suck suck suck suck suck suck suck suck suck suck suck suck suck suck suck suck suck suck suck suck suck suck suck suck suck suck suck suck suck suck suck suck suck suck suck suck suck suck suck suck suck suck suck suck suck suck suck suck suck suck suck suck suck suck suck suck suck suck suck suck suck suck suck suck suck suck suck suck suck suck suck suck suck suck suck suck suck suck suck suck suck suck suck suck suck suck suck suck suck suck suck suck suck suck suck suck suck suck suck suck suck suck suck suck suck suck suck suck suck suck suck suck suck suck suck suck suck suck suck suck suck suck suck suck suck suck suck suck suck suck suck suck suck suck suck suck suck suck suck suck suck suck suck suck suck suck suck suck suck suck suck suck suck suck suck suck suck suck suck suck suck suck suck suck suck suck suck suck suck suck suck suck suck suck suck suck suck suck suck suck suck suck suck suck suck suck suck suck suck suck suck suck suck suck suck suck suck suck suck suck suck suck suck suck suck suck suck suck suck suck suck suck suck suck suck suck suck suck suck suck suck suck suck suck suck suck suck suck suck suck suck suck suck suck suck suck suck suck suck suck suck suck suck suck suck suck suck suck suck suck suck suck suck suck suck suck suck suck suck suck suck suck suck,"== Grrrrrrrrrrrrrrrrrrrrrrrrrrrrrrrrrrrrrrrrrrrrrrrrrrrrrrrrrrrrrrrrrrrrrrrrrrrrrrrrrrrrrrrrrrrrrrrrrrrrrrrrrrrrrrrrrrrrrrrrrrrrrrrrrrrrrrrrrrrrrrrrrrrrrrrrrrrrrrrrrrrrrrrrrrrrrrrrrrrrrrrrrrrrrrrrrrrr == 

 You suck suck suck suck suck suck suck suck suck suck suck suck suck suck suck suck suck suck suck suck suck suck suck suck suck suck suck suck suck suck suck suck suck suck suck suck suck suck suck suck suck suck suck suck suck suck suck suck suck suck suck suck suck suck suck suck suck suck suck suck suck suck suck suck suck suck suck suck suck suck suck suck suck suck suck suck suck suck suck suck suck suck suck suck suck suck suck suck suck suck suck suck suck suck suck suck suck suck suck suck suck suck suck suck suck suck suck suck suck suck suck suck suck suck suck suck suck suck suck suck suck suck suck suck suck suck suck suck suck suck suck suck suck suck suck suck suck suck suck suck suck suck suck suck suck suck suck suck suck suck suck suck suck suck suck suck suck suck suck suck suck suck suck suck suck suck suck suck suck suck suck suck suck suck suck suck suck suck suck suck suck suck suck suck suck suck suck suck suck suck suck suck suck suck suck suck suck suck suck suck suck suck suck suck suck suck suck suck suck suck suck suck suck suck suck suck suck suck suck suck suck suck suck suck suck suck suck suck suck suck suck suck suck suck suck suck suck suck suck suck suck suck suck suck suck suck suck suck suck suck suck suck suck suck suck suck suck suck suck suck suck suck suck suck suck suck suck suck suck suck suck suck suck suck suck suck suck suck suck suck suck suck suck suck suck suck suck suck suck suck suck suck suck suck suck suck suck suck suck suck suck suck suck suck suck suck suck suck suck suck suck suck suck suck suck suck suck suck suck suck suck suck suck suck suck suck suck suck suck suck suck suck suck suck suck suck suck suck suck suck suck suck suck suck suck suck suck suck suck suck suck suck suck suck suck suck suck suck suck suck suck suck suck suck suck suck suck suck suck suck suck suck suck suck suck suck suck suck suck suck suck suck suck suck suck suck suck suck suck suck suck suck suck suck suck suck suck suck suck suck suck suck suck suck suck suck suck suck suck suck suck suck suck suck suck suck suck suck suck suck suck suck suck suck suck suck suck suck suck suck suck suck suck suck suck suck suck suck suck suck suck suck suck suck suck suck suck suck suck suck suck suck suck suck suck suck suck suck suck suck suck suck suck suck suck suck suck suck suck suck suck suck suck suck suck suck suck suck suck suck suck suck suck suck suck suck suck suck suck suck suck suck suck suck suck suck suck suck suck suck suck suck suck suck suck suck suck suck suck suck suck suck suck suck suck suck suck suck suck suck suck suck suck suck suck suck suck suck suck suck suck suck suck suck suck suck suck suck suck suck suck suck suck suck suck suck suck suck suck suck suck suck suck suck suck suck suck suck suck suck suck suck suck suck suck suck suck suck suck suck suck suck suck suck suck suck suck suck suck suck suck suck suck suck suck suck suck suck suck suck suck suck suck suck suck suck suck suck suck suck suck suck suck suck suck suck suck suck suck suck suck suck suck suck suck suck suck suck suck suck suck suck suck suck suck suck suck suck suck suck suck suck suck suck suck suck suck suck suck suck suck suck suck suck suck suck suck suck suck suck suck suck suck suck suck suck suck suck suck suck suck suck suck suck suck suck suck suck suck suck suck suck suck suck suck suck suck suck suck suck suck suck suck suck suck suck suck suck suck suck suck suck suck suck suck suck suck suck suck suck suck suck suck suck suck suck suck suck suck suck suck suck suck suck suck suck suck suck suck suck suck suck suck suck suck suck suck suck suck suck suck suck suck suck suck suck suck suck suck suck suck suck suck suck suck suck suck suck suck suck suck suck suck suck suck suck suck suck suck suck suck suck suck suck suck suck suck suck suck suck suck suck suck suck suck suck suck suck suck suck suck suck suck suck suck suck suck suck suck suck suck suck suck suck suck suck suck suck suck suck suck suck suck suck suck suck suck suck suck suck suck suck suck suck suck suck suck suck suck suck suck suck suck suck suck suck suck suck suck suck suck suck suck suck suck suck suck suck suck suck suck suck suck suck suck suck suck suck suck suck suck suck suck suck suck suck suck suck suck suck suck suck suck suck suck suck suck suck suck suck suck suck suck suck suck suck suck suck suck suck suck suck suck suck suck suck suck suck suck suck suck suck suck suck suck suck suck suck suck suck suck suck suck suck suck suck suck suck suck suck suck suck suck suck suck suck suck suck suck suck suck suck suck suck suck suck suck suck suck suck suck suck suck suck suck suck suck suck suck suck suck suck suck suck suck suck suck suck suck suck suck suck suck"
